{"schema_version":"8dionysus_public_route_map_v3","schema_ref":"schemas/public-route-map-v3.schema.json","owner_repo":"8Dionysus","surface_kind":"orientation_surface","authority_ref":"docs/PUBLIC_ENTRY_POSTURE.md","posture":"route-map-only","validation_refs":["scripts/build_public_route_map.py","scripts/validate_public_route_map.py","tests/test_public_route_map.py"],"routes":[{"route_id":"ecosystem-understanding","need":"ecosystem understanding","canonical_repo":"Agents-of-Abyss","capsule_ref":"Agents-of-Abyss:generated/center_entry_map.min.json","authority_ref":"Agents-of-Abyss:CHARTER.md","verification_refs":["Agents-of-Abyss:generated/ecosystem_registry.min.json","Agents-of-Abyss:generated/federation_supporting_inventory.min.json"]},{"route_id":"workspace-bootstrap","need":"local workspace bootstrap and typed control-plane use","canonical_repo":"aoa-sdk","capsule_ref":"aoa-sdk:generated/workspace_control_plane.min.json","authority_ref":"aoa-sdk:docs/boundaries.md","verification_refs":["aoa-sdk:docs/workspace-layout.md","aoa-sdk:docs/versioning.md","8Dionysus:docs/WORKSPACE_INSTALL.md","8Dionysus:docs/CODEX_PLANE_REGENERATION.md"]},{"route_id":"goal-space-dashboard","need":"Goal Space/operator projection","canonical_repo":"aoa-dashboard","capsule_ref":"aoa-dashboard:contracts/organ_contract.json","authority_ref":"aoa-dashboard:docs/ORGAN_CONTRACT.md","verification_refs":["aoa-dashboard:docs/ADMISSION.md","Agents-of-Abyss:generated/ecosystem_registry.min.json","aoa-sdk:docs/workspace-layout.md"]},{"route_id":"profile-correction","need":"profile-only route or glossary correction","canonical_repo":"8Dionysus","capsule_ref":"8Dionysus:GLOSSARY.md","authority_ref":"8Dionysus:docs/PUBLIC_ENTRY_POSTURE.md","verification_refs":["8Dionysus:README.md","8Dionysus:docs/START_HERE.md","8Dionysus:docs/QUESTBOOK_PROFILE_BOUNDARY.md"]}]}
